id,address,address2,tel,fax,category,prefecture,district,pic_appearance,pic_map,type,lat,lng
1,ฝ่ายลูกค้าสัมพันธ์,อาคารแคปปิตอลทาวเวอร์ออลซีซั่นส์เพลสชั้น12,1751,02-257-7920,สำนักงานใหญ่,กรุงเทพมหานคร,ปทุมวัน,,map_callcenter.jpg,HQ(call center),13.738833,100.547308
2,อาคารธนิยะชั้น2สีลม,ติดกับทางเชื่อมสถานีรถไฟศาลาแดง62ถนนสีลมกรุงเทพ10330,02-632-6700,02-632-6709,สึลม,กรุงเทพมหานคร,,pic_silomthaniya.jpg,map_silomthaniya.jpg,Branch,13.728765,100.534002
3,บิ๊กซีเอ๊กซ์ตร้ารัชดา(คาร์ฟูร์เดิม),ชั้น1ข้างร้านเอ็มเค(MK),,,จุดให้บริการในกรุงเทพฯ และปริมณฑล,กรุงเทพมหานคร,,,map_ratchadapisek.jpg,Servicepoint,13.7687103,100.571841
4,บิ๊กซีดาวคะนอง,ชั้น2เยื้องร้านบิ๊กคาเมร่า(Big Camera),,,จุดให้บริการในกรุงเทพฯ และปริมณฑล,กรุงเทพมหานคร,,pic_daokanong.jpg,map_daokanong.jpg,Servicepoint,13.69906994,100.4824322
5,N mark plaza (น้อมจิตต์บางกะปิ),ชั้น2หลังจอทีวีพลาสมาติดทางเชื่อมระหว่างเดอะมอลล์กับห้างน้อมจิตต์,,,จุดให้บริการในกรุงเทพฯ และปริมณฑล,กรุงเทพมหานคร,,,map_nomjitkapi.jpg,Servicepoint,13.767742,100.642791
6,บิ๊กซีหัวหมาก(รามคำแหง),ชั้นใต้ดินตรงข้ามร้านดีแทค(DTAC),,,จุดให้บริการในกรุงเทพฯ และปริมณฑล,กรุงเทพมหานคร,,bigmak.jpg,map_bigmak.jpg,Servicepoint,13.75552015,100.6128171
7,บิ๊กซีสะพานใหม่,ชั้น1ข้างร้านโอเรียนทอลพริ๊นเซส(Oriental Princess),,,จุดให้บริการในกรุงเทพฯ และปริมณฑล,กรุงเทพมหานคร,,,map_newbridge.jpg,Servicepoint,13.890992,100.606296
8,บิ๊กซีพระราม2,ชั้น1หน้าร้านเอสแอนด์พี(S&P),,,จุดให้บริการในกรุงเทพฯ และปริมณฑล,กรุงเทพมหานคร,,,map_rama2.jpg,Servicepoint,13.661469,100.440548
9,บางแคพลาซ่า,ตรงข้ามเดอะมอลล์บางแค36/4ม.4ซ.เพชรเกษม47/2ถ.เพชรเกษมแขวงบางแคเขตบางแคกทม.,,,จุดให้บริการในกรุงเทพฯ และปริมณฑล,กรุงเทพมหานคร,,bangplaza.jpg,map_bangplaza.jpg,Servicepoint,13.710333,100.408766
10,บิ๊กซีบางนา,ชั้น1ตรงข้ามเคเอฟซี(KFC)ติดร้านโอเรียนทอลพริ้นเซส(Oriental Princess),,,จุดให้บริการในกรุงเทพฯ และปริมณฑล,กรุงเทพมหานคร,,,map_bigbang.jpg,Servicepoint,13.668862,100.635734
11,บิ๊กซีราชดำริ,ชั้น3ข้างร้านบิ๊กคาเมร่า(Big Camera)บันไดเลื่อนฝั่งลานจอดรถ,,,จุดให้บริการในกรุงเทพฯ และปริมณฑล,กรุงเทพมหานคร,,ratchadamri.jpg,map_ratchadamri.jpg,Servicepoint,13.747168,100.541271
12,ตรงข้ามซีคอนสแควร์ศรีนครินทร์,13/31-32 ถ.ศรีนครินทร์แขวงหนองบอนเขตประเวศกทม.,,,จุดให้บริการในกรุงเทพฯ และปริมณฑล,กรุงเทพมหานคร,,srinakarin.jpg,map_srinakarin.jpg,Servicepoint,13.692899,100.647105
13,บิ๊กซีสะพานควาย,ชั้นใต้ดิน(ชั้นG)หน้าธนาคารไทยพาณิชย์,,,จุดให้บริการในกรุงเทพฯ และปริมณฑล,กรุงเทพมหานคร,,,map_saphankwai.jpg,Servicepoint,13.791298,100.54956
14,บิ๊กซีแฟชั่นไอส์แลนด์มีนบุรี,ประตูทางเข้าบิ๊กซีชั้น2,,,จุดให้บริการในกรุงเทพฯ และปริมณฑล,กรุงเทพมหานคร,,,map_islandsafari.jpg,Servicepoint,13.825621,100.678815
15,บิ๊กซีลาดพร้าว,ชั้น1หน้าจุดบริการลูกค้าบิ๊กซี,,,จุดให้บริการในกรุงเทพฯ และปริมณฑล,กรุงเทพมหานคร,,,map_latphrao.jpg,Servicepoint,13.785116,100.612709
16,บิ๊กซีเอ๊กซ์ตร้าพระราม4,ชั้น1ตรงข้ามสเวนเซ่นส์,,,จุดให้บริการในกรุงเทพฯ และปริมณฑล,กรุงเทพมหานคร,,,map_extrarama.jpg,Servicepoint,13.71876978,100.568912
17,ยูเนี่ยนมอลล์,ชั้นF2 (ชั้น3)ข้างCoffee Today,,,จุดให้บริการในกรุงเทพฯ และปริมณฑล,กรุงเทพมหานคร,,,map_unionmall.jpg,Servicepoint,13.813775,100.56169
18,พรอมิสสาขาปิ่นเกล้า,เยื้องพาต้าปิ่นเกล้า,,,จุดให้บริการในกรุงเทพฯ และปริมณฑล,กรุงเทพมหานคร,,pic_promisepinklao.jpg,map_promisepinklao.jpg,Servicepoint,13.770016,100.484394
19,บิ๊กซีวงศ์สว่าง,ชั้น1เยื้องธนาคารกสิกรไทยตึกบิ๊กซีซุปเปอร์เซ็นเตอร์(ร้านเวสเทิร์นยูเนี่ยนเดิม),,,จุดให้บริการในกรุงเทพฯ และปริมณฑล,กรุงเทพมหานคร,,pic_wongsawang.jpg,map_wongsawang.jpg,Servicepoint,13.826595,100.528367
20,บิ๊กซี สุขาภิบาล 3,บิ๊กซีสุขาภิบาล3,,,จุดให้บริการในกรุงเทพฯ และปริมณฑล,กรุงเทพมหานคร,,,map_sanitation3.jpg,Servicepoint,13.807551,100.726395
21,เซ็นเตอร์วัน(อนุเสาวรีย์ฯ),ชั้น1ลานโปรโมชั่นข้างบันไดหลังเสาLED,,,จุดให้บริการในกรุงเทพฯ และปริมณฑล,กรุงเทพมหานคร,,,map_centre.jpg,Servicepoint,13.76399,100.5393
22,บิ๊กซีเอ๊กซ์ตร้าอ่อนนุช,ชั้น1หน้าประตูเข้า-ออกบิ๊กซี,,,จุดให้บริการในกรุงเทพฯ และปริมณฑล,กรุงเทพมหานคร,,,map_bigcextra.jpg,Servicepoint,13.70919107,100.6015384
23,บิ๊กซีเอ๊กซ์ตร้าเพชรเกษม,ชั้น1ตรงประตูทางเข้าด้านหน้าใกล้กับธนาคารกสิกรไทย,,,จุดให้บริการในกรุงเทพฯ และปริมณฑล,กรุงเทพมหานคร,,,map_bigcextraphetkasem.jpg,Servicepoint,13.7091598,100.3667593
24,บิ๊กซีนครปฐม,ชั้น2ใกล้จุดบริการลูกค้าตรงข้ามร้านขายยาเซฟดรัก(Save drug),,,จุดให้บริการในกรุงเทพฯ และปริมณฑล,นครปฐม,,,map_nakhonpathom.jpg,Servicepoint,13.8126,100.072
25,บิ๊กซีอ้อมใหญ่,ชั้น1ตรงทางเดินหน้าร้านไอศครีมแดรี่ควีน(Dairy Queen)ใกล้สเวนเซ่นส์(Swensens)และเอสแอนด์พี(S&P),,,จุดให้บริการในกรุงเทพฯ และปริมณฑล,นครปฐม,,,map_bigdetour.jpg,Servicepoint,13.7065175,100.2812129
26,บิ๊กซีเอ๊กซ์ตร้าบางใหญ่(คาร์ฟูร์เดิม),ชั้น2หน้าร้านดีแทค(DTAC),,,จุดให้บริการในกรุงเทพฯ และปริมณฑล,นนทบุรี,,,map_bigcextrayai.jpg,Servicepoint,13.88153221,100.4082155
27,บิ๊กซีเอ๊กซ์ตร้าแจ้งวัฒนะ(คาร์ฟูร์เดิม),ชั้น1ประตูทางเข้าศูนย์อาหารตรงข้ามแมคโดนัลด์(MC Donald),,,จุดให้บริการในกรุงเทพฯ และปริมณฑล,นนทบุรี,,,map_bigcextrachaeng.jpg,Servicepoint,13.90570009,100.5148816
28,โรบินสัน ศรีสมาน,ชั้น 2 หน้าธนาคารกรุงเทพ (ข้าง 3 BB),,,จุดให้บริการในกรุงเทพฯ และปริมณฑล,นนทบุรี,,,map_robinsonsrisamarn.jpg,Servicepoint,13.93942,100.552885
29,แกรนด์พลาซ่างามวงศ์วาน,(ห้างแกรนด์พลาซ่าอยู่ตรงข้ามกับThe Mallงามวงศ์วาน)ชั้น2โซนกลางลานโปรโมชั่น,,,จุดให้บริการในกรุงเทพฯ และปริมณฑล,นนทบุรี,,,map_grandplazamall.jpg,Servicepoint,13.856865,100.541747
30,บิ๊กซีติวานนท์,ชั้น1หน้าร้านเอ็มเค(MK),,,จุดให้บริการในกรุงเทพฯ และปริมณฑล,นนทบุรี,,,map_bigctiwanon.jpg,Servicepoint,13.845001,100.510551
31,บิ๊กซีฟิวเจอร์ปาร์ครังสิต,ชั้น1หน้าร้านหนังสือซีเอ็ดบุ๊ค(SE-ED Book)ใกล้จุดบริการลูกค้า,,,จุดให้บริการในกรุงเทพฯ และปริมณฑล,ปทุมธานี,,,map_futureparkrangsit.jpg,Servicepoint,13.989313,100.617894
32,บิ๊กซีเอ๊กซ์ตร้าลำลูกกา(คลอง4),ชั้น1หน้าประตูทางเข้า-ออก(ฝั่งเอ็มเค),,,จุดให้บริการในกรุงเทพฯ และปริมณฑล,ปทุมธานี,,,map_bigcextraka.jpg,Servicepoint,13.93385892,100.6821334
33,บิ๊กซีบางพลี,ชั้น1ตรงข้ามร้านทองออโรร่า(AURORA),,,จุดให้บริการในกรุงเทพฯ และปริมณฑล,สมุทรปราการ,,,map_bigbangphli.jpg,Servicepoint,13.603787,100.708007
34,เมกาบางนา(Mega Bangna),ชั้น1ข้างเมืองไทยประกันชีวิต(เมกามันนี่โซน),,,จุดให้บริการในกรุงเทพฯ และปริมณฑล,สมุทรปราการ,,pic_megabangna.jpg,map_megabangna.jpg,Servicepoint,13.646592,100.680267
35,บิ๊กซีสุขสวัสดิ์,ชั้น2ตรงข้ามร้านหอแว่น,,,จุดให้บริการในกรุงเทพฯ และปริมณฑล,สมุทรปราการ,,,map_csuksawat.jpg,Servicepoint,13.653805,100.522381
36,บิ๊กซีสมุทรปราการ,ชั้น1ประตูทางเข้าหน้าธนาคารไทยพาณิชย์,,,จุดให้บริการในกรุงเทพฯ และปริมณฑล,สมุทรปราการ,,,map_bigbangoverseas.jpg,Servicepoint,13.584328,100.607022
37,อิมพีเรียลเวิลด์สำโรง,ชั้นใต้ดินข้างร้านพิซซ่า(The Pizza,,,จุดให้บริการในกรุงเทพฯ และปริมณฑล,สมุทรปราการ,,,map_imperialworldsamrong.jpg,Servicepoint,13.649917,100.596763
38,บิ๊กซีกาญจนบุรี,ติดร้านไปรษณีย์,,,สาขา และจุดให้บริการต่างจังหวัด,กาญจนบุรี,,pic_ckanchanaburi.jpg,map_ckanchanaburi.jpg,Servicepoint,14.048168,99.507695
39,บิ๊กซีกำแพงเพชร,ชั้น2ข้างบันไดเลื่อน(ฝั่งธนาคารออมสิน),,,สาขา และจุดให้บริการต่างจังหวัด,กำแพงเพชร,,,map_ckamphaengphet.jpg,Servicepoint,16.4741,99.5411
40,บิ๊กซีขอนแก่น,ชั้น2เยื้องจุดบริการลูกค้าบิ๊กซี,,,สาขา และจุดให้บริการต่างจังหวัด,ขอนแก่น,,,map_bigcthailand.jpg,Servicepoint,16.42476539,102.8190064
41,พรอมิสสาขาขอนแก่น,เลขที่552/5ถนนหน้าเมืองต.ในเมืองอ.เมืองจ.ขอนแก่น40000,043-220-666,043-226-232,สาขา และจุดให้บริการต่างจังหวัด,ขอนแก่น,,pic_promisekhonkaen.jpg,map_promisekhonkaen.jpg,Branch,16.423252,102.833193
42,บิ๊กซีจันทบุรี,ชั้น2ข้างบันไดเลื่อนหน้าโรงภาพยนตร์เมเจอร์(Major Cineplex),,,สาขา และจุดให้บริการต่างจังหวัด,จันทบุรี,,,map_chanthaburi.jpg,Servicepoint,12.59817,102.09929
43,บิ๊กซี-เมเจอร์ฉะเชิงเทรา,หน้าจุดบริการลูกค้าบิ๊กซี,,,สาขา และจุดให้บริการต่างจังหวัด,ฉะเชิงเทรา,,,map_chachoengsao.jpg,Servicepoint,13.6909,101.056
44,พรอมิสสาขาพัทยา,ข้างมูลนิธิคุณพ่อเรย์ตรงข้ามธ.ออมสิน,,,สาขา และจุดให้บริการต่างจังหวัด,ชลบุรี,,pic_promisepattaya.jpg,map_promisepattaya.jpg,Servicepoint,12.938363,100.902363
45,แหลมทองบางแสน,ชั้น1ข้างร้านเอสแอนด์พี(ตรงข้ามท็อปมาร์เก็ต),,,สาขา และจุดให้บริการต่างจังหวัด,ชลบุรี,,pic_somepeninsula.jpg,map_somepeninsula.jpg,Servicepoint,13.287114,100.926722
46,บิ๊กซีเอ๊กซ์ตร้าชลบุรี,ชั้น2หน้าร้านเอทูแซด(AIIZ),,,สาขา และจุดให้บริการต่างจังหวัด,ชลบุรี,,,map_bigcextrachonburi.jpg,Servicepoint,13.30825536,100.9568117
47,ฮาร์เบอร์มอลล์(แหลมฉบัง),ชั้นGตรงข้ามร้านวัตสัน(Watsan),,,สาขา และจุดให้บริการต่างจังหวัด,ชลบุรี,,,map_harbourmall.jpg,Servicepoint,13.079519,100.92181
48,พรอมิสสาขาชัยภูมิ,ตึกชัยปรีดาอพาร์ทเม้นท์เลขที่199/9หมู่7ต.ในเมืองอ.เมืองจ.ชัยภูมิ36000,044-818-220,044-818-221,สาขา และจุดให้บริการต่างจังหวัด,ชัยภูมิ,,pic_promisechaiyaphum.jpg,map_promisechaiyaphum.jpg,Branch,15.803075,102.037496
49,พรอมิสสาขาเชียงราย,ถนนธนาลัย(เยื้องธนาคารธกส),,,สาขา และจุดให้บริการต่างจังหวัด,เชียงราย,,pic_promisechiangrai.jpg,map_promisechiangrai.jpg,Servicepoint,19.908018,99.825972
50,บิ๊กซีเชียงใหม่(ดอนจั่น),ชั้น1หน้าร้านเคเอฟซี(KFC),,,สาขา และจุดให้บริการต่างจังหวัด,เชียงใหม่,,,map_bigcchiang.jpg,Servicepoint,18.769,99.033
51,บิ๊กซีหางดง,ชั้น 1 ตรงข้ามธนาคารกรุงเทพ,,,สาขา และจุดให้บริการต่างจังหวัด,เชียงใหม่,,,map_bigcdong.jpg,Servicepoint,18.74496332,98.96208376
52,บิ๊กซีตรัง,ชั้น2ข้างบันไดเลื่อน(ฝั่งศูนย์อาหาร),,,สาขา และจุดให้บริการต่างจังหวัด,ตรัง,,,map_bigtrang.jpg,Servicepoint,7.545004,99.6156
53,พรอมิสสาขานครราชสีมา,เลขที่230/30ถนนมิตรภาพต.ในเมืองอ.เมืองจ.นครราชสีมา30000,"044-243-411, 044-245-200",044-243-412,สาขา และจุดให้บริการต่างจังหวัด,นครราชสีมา,,pic_promiseratchasima.jpg,map_promiseratchasima.jpg,Branch,14.986687,102.095657
54,ห้างสหไทยพลาซ่า,ชั้น2เยื้องทีโอที(TOT),,,สาขา และจุดให้บริการต่างจังหวัด,นครศรีธรรมราช,,,map_unitedthailandplazamall.jpg,Servicepoint,8.160437,99.675694
55,บิ๊กซีนครศรีธรรมราช,ข้างทางเข้าลานจอดรถบิ๊กซีซุปเปอร์มาร์เก็ต,,,สาขา และจุดให้บริการต่างจังหวัด,นครศรีธรรมราช,,pic_nakhonsithammarat.jpg,map_nakhonsithammarat.jpg,Servicepoint,8.441263,99.963134
56,บิ๊กซีนครสวรรค์(วีสแควร์พลาซ่า),ชั้น2ตรงข้ามห้างทองโต๊ะกัง,,,สาขา และจุดให้บริการต่างจังหวัด,นครสวรรค์,,,map_bigcnakhonsawa.jpg,Servicepoint,15.69505684,100.1213855
57,บิ๊กซีบุรีรัมย์,หน้าร้านมิสเตอร์โดนัท(Mister Donut),,,สาขา และจุดให้บริการต่างจังหวัด,บุรีรัมย์,,,map_bigcram.jpg,Servicepoint,14.96988141,103.0818377
58,เทสโก้โลตัสนวนคร,ชั้น1ตรงข้ามสปอร์ตโดม,,,สาขา และจุดให้บริการต่างจังหวัด,ปทุมธานี,,,map_tesconava.jpg,Servicepoint,14.12042,100.617179
59,พรอมิสสาขาหัวหิน,ข้างธนาคารธอส.ระหว่างซอยหัวหิน80และ82,,,สาขา และจุดให้บริการต่างจังหวัด,ประจวบคีรีขันธ์,,pic_promisehuahin.jpg,map_promisehuahin.jpg,Servicepoint,12.565308,99.959093
60,พรอมิสสาขาปราจีนบุรี,ตรงข้ามนิคมอุตสาหกรรม304 (ข้างตลาด304),,,สาขา และจุดให้บริการต่างจังหวัด,ปราจีนบุรี,,,map_promiseprachinburi.jpg,Servicepoint,13.917274,101.573278
61,บิ๊กซีเพชรบุรี,ชั้น1หน้าประตูเข้า-ออกห้างระหว่างเจมาร์ท(J-Mart)และเอสแอนด์พี(S&P),,,สาขา และจุดให้บริการต่างจังหวัด,เพชรบุรี,,,map_ckanchanaburi.jpg,Servicepoint,13.079,99.9482
62,บิ๊กซีเพชรบูรณ์,เยื้องร้านดีแทค(DTAC),,,สาขา และจุดให้บริการต่างจังหวัด,เพชรบูรณ์,,pic_cphetchabun.jpg,map_cphetchabun.jpg,Servicepoint,16.39276,101.13233
63,บิ๊กซีพิษณุโลก,ชั้น2ตรงข้ามธนาคารกรุงเทพ,,,สาขา และจุดให้บริการต่างจังหวัด,พิษณุโลก,,,map_bigphitsanulok.jpg,Servicepoint,16.81580768,100.2896565
64,บิ๊กซีภูเก็ต,ชั้น1หน้าเคเอฟซี(KFC)ตรงประตูทางเข้าห้างฯ,,,สาขา และจุดให้บริการต่างจังหวัด,ภูเก็ต,,pic_bigcphuket.jpg,map_bigcphuket.jpg,Servicepoint,7.8959,98.3674
65,ห้างเสริมไทยคอมเพล็กซ์(มหาสารคาม),ชั้น1หน้าโลตัสซุปเปอร์มาร์เก็ต,,,สาขา และจุดให้บริการต่างจังหวัด,มหาสารคาม,,,map_mahasarakham.jpg,Servicepoint,16.201523,103.27677
66,รอมิสสาขาร้อยเอ็ด,เลขที่56/6ถ.เทวาภิบาลต.ในเมืองอ.ร้อยเอ็ดจ.ร้อยเอ็ด45000,043-515-727,043-515-211,สาขา และจุดให้บริการต่างจังหวัด,ร้อยเอ็ด,,pic_promisemajorroiet.jpg,map_promisemajorroiet.jpg,Branch,16.057909,103.631157
67,ซีเคพลาซ่า(ระยอง),ชั้น1หน้าประตูเข้า-ออกฝั่งบิ๊กซี,,,สาขา และจุดให้บริการต่างจังหวัด,ระยอง,,,map_ckplaza.jpg,Servicepoint,12.984046,101.211958
68,แหลมทองระยอง,ชั้น2ติดร้านกล้องถ่ายรูปข้างบันไดเลื่อนลง,,,สาขา และจุดให้บริการต่างจังหวัด,ระยอง,,pic_peninsulabangkok.jpg,map_peninsulabangkok.jpg,Servicepoint,12.68257642,101.2425408
69,บิ๊กซีราชบุรี,ชั้น1หน้ามิสเตอร์โดนัท(Mister Donut),,,สาขา และจุดให้บริการต่างจังหวัด,ราชบุรี,,,map_bigcratchaburi.jpg,Servicepoint,13.5506,99.8231
70,บิ๊กซีลพบุรี,ชั้น1เยื้องบันไดเลื่อนลงจากซุปเปอร์มาร์เก็ต,,,สาขา และจุดให้บริการต่างจังหวัด,ลพบุรี,,,map_bigclopburi.jpg,Servicepoint,14.7946,100.672
71,บิ๊กซีเลย,หน้าร้านเคเอฟซี(KFC),,,สาขา และจุดให้บริการต่างจังหวัด,เลย,,,map_bigcs.jpg,Servicepoint,17.462905,101.72789
72,บิ๊กซีลำปาง,ชั้น2ตรงข้ามร้านบิ๊กคาเมร่า,,,สาขา และจุดให้บริการต่างจังหวัด,ลำปาง,,,map_bigclampang.jpg,Servicepoint,18.2755,99.4812
73,บิ๊กซีลำพูน,ชั้น1หน้าร้านเอ็มเค(MK),,,สาขา และจุดให้บริการต่างจังหวัด,ลำพูน,,,map_clamphun.jpg,Servicepoint,18.591,99.0412
