id,address,address2,tel,fax,category,prefecture,district,pic_appearance,pic_map,type,lat,lng
74,พรอมิสสาขาศรีสะเกษ,เลขที่1199/2ถ.วิจิตรนครต.เมืองเหนืออ.เมืองจ.ศรีสะเกษ33000,045-643-656,045-643-649,สาขา และจุดให้บริการต่างจังหวัด,ศรีสะเกษ,,pic_promisesaket.jpg,map_promisesaket.jpg,Branch,15.118865,104.333183
75,บิ๊กซีสกลนคร,ตรงข้ามจุดชำระค่าสินค้าบิ๊กซี(ฝั่งธนาคารกรุงเทพ),,,สาขา และจุดให้บริการต่างจังหวัด,สกลนคร,,,map_sakonc.jpg,Servicepoint,17.15965366,104.149425
76,ถนนเพชร์เกษมเยื้องห้างสยามนครินทร์,489/17-489/18 ถ.เพชรเกษมต.หาดใหญ่อ.หาดใหญ่จ.สงขลา90110,,,สาขา และจุดให้บริการต่างจังหวัด,สงขลา,,pic_presidentbush.jpg,map_presidentbush.jpg,Servicepoint,7.003314,100.491775
77,บิ๊กซีหาดใหญ่,ชั้น1หน้ามิสเตอร์โดนัท(Mister Donut),,,สาขา และจุดให้บริการต่างจังหวัด,สงขลา,,,map_bighat.jpg,Servicepoint,7.03824,100.468
78,บิ๊กซีสมุทรสาคร(มหาชัย),ชั้น1ข้างร้านยาโยอิ(Yayoi),,,สาขา และจุดให้บริการต่างจังหวัด,สมุทรสาคร,,,map_csakhon.jpg,Servicepoint,13.5652,100.2726
79,บิ๊กซีสระแก้ว,ข้างร้านดีแทค,,,สาขา และจุดให้บริการต่างจังหวัด,สระแก้ว,,pic_csakaeo.jpg,map_csakaeo.jpg,Servicepoint,13.81166,102.077149
80,ห้างทวีกิจสระบุรี,ชั้น 1 ใกล้ทางเข้าบิ๊กซี (Big C),,,สาขา และจุดให้บริการต่างจังหวัด,สระบุรี,,,map_thaveekitsaraburi.jpg,Servicepoint,14.523245,100.917936
81,พรอมิสสาขาสุพรรณบุรี,ถ.มาลัยแมนข้างแสนรักษ์รักษาสัตว์(ทางไปหอนาฬิกาบรรหาร-แจ่มใส),,,สาขา และจุดให้บริการต่างจังหวัด,สุพรรณบุรี,,pic_promisesuphanburi.jpg,map_promisesuphanburi.jpg,Servicepoint,14.48044,100.127223
82,บิ๊กซีสุราษฎร์ธานี,ชั้น1หน้าศูนย์อาหาร,,,สาขา และจุดให้บริการต่างจังหวัด,สุราษฎร์ธานี,,pic_bigsurat.jpg,map_bigsurat.jpg,Servicepoint,9.14819,99.3699
83,พรอมิสสาขาสุราษฎร์ธานี,ถนนชนเกษม(เยื้องธนาคารยูโอบี),,,สาขา และจุดให้บริการต่างจังหวัด,สุราษฎร์ธานี,,pic_promisesurat.jpg,map_promisesurat.jpg,Servicepoint,9.139989,99.328332
84,บิ๊กซีสุรินทร์,ชั้น1ตรงข้ามร้านเคเอฟซี(KFC),,,สาขา และจุดให้บริการต่างจังหวัด,สุรินทร์,,,map_bigcsurin.jpg,Servicepoint,14.8723,103.51
85,อยุธยาปาร์ค,ชั้น1ข้างธ.ก.ส. (BAAC),,,สาขา และจุดให้บริการต่างจังหวัด,อยุธยา,,pic_ayutthayapark.jpg,map_ayutthayapark.jpg,Servicepoint,14.335437,100.61092
86,บิ๊กซีอุดรธานี,ชั้น1ข้างร้านทรีบอรดแบรนด์(3BB),,,สาขา และจุดให้บริการต่างจังหวัด,อุดรธานี,,,map_cthani.jpg,Servicepoint,17.3866,102.824
87,พรอมิสสาขาอุดรธานี,ถ.ประจักษ์เยื้องโรงเรียนอุดรวิทยา(รร.จีน),,,สาขา และจุดให้บริการต่างจังหวัด,อุดรธานี,,pic_udonthani.jpg,map_udonthani.jpg,Servicepoint,17.406249,102.795311
88,โลตัสยูดีทาวน์,ติดร้านดังกิ้นโดนัท(Dunkin Donut),,,สาขา และจุดให้บริการต่างจังหวัด,อุดรธานี,,pic_lotusudtown.jpg,map_lotusudtown.jpg,Servicepoint,17.401793,102.804765
89,อุบลราชธานี2,ถ.ธรรมวิถีข้างธ.กสิกรไทย(ตลาดนิกรธานี),,,สาขา และจุดให้บริการต่างจังหวัด,อุบลราชธานี,,pic_ubonratchathani.jpg,map_ubonratchathani.jpg,Servicepoint,15.269709,104.83932
90,พรอมิสสาขาอุบลราชธานี,อาคารสินราชบุตรเลขที่47ชั้น1 (ห้อง102-103)ถนนราชบุตรต.ในเมืองอ.เมืองจ.อุบลราชธานี34000,"045-250-099, 045-250-100",045-243-717,สาขา และจุดให้บริการต่างจังหวัด,อุบลราชธานี,,pic_promiseubonratchathani.jpg,map_promiseubonratchathani.jpg,Branch,15.226666,104.858558
